[
  {
    "itemId": "item-00001",
    "name": "East",
    "price": 1392.02,
    "quantity": 57,
    "shortdescription": "Site individual resource.",
    "missingparts": [
      {
        "part": "culture",
        "image": "https://example.com/missing-part.jpg"
      },
      {
        "part": "these",
        "image": "https://example.com/missing-part.jpg"
      }
    ],
    "defects": [
      {
        "defect": "TV issue",
        "image": "https://example.com/defect.jpg"
      }
    ],
    "accessories": [],
    "longdescription": "Which food huge purpose me cut human. Professional whatever because animal.",
    "condition": "new",
    "brand": "Diaz, Perkins and Young",
    "model": "Model-153",
    "thumbnail": "https://example.com/thumbnail.jpg",
    "tags": [
      "accessory",
      "portable",
      "gaming"
    ],
    "complementaryImages": [
      "https://example.com/image0.jpg"
    ],
    "priceNew": 856.8,
    "urlNew": "https://example.com/item-new",
    "category": "health",
    "location": "New Jerry, VA",
    "transactionStatus": [
      "transaction66529",
      "transaction56372"
    ]
  },
  {
    "itemId": "item-00002",
    "name": "Baby",
    "price": 649.11,
    "quantity": 22,
    "shortdescription": "Local direction home bar source.",
    "missingparts": [],
    "defects": [],
    "accessories": [],
    "longdescription": "Same these when best. Expert stuff own. Can anyone you sea want pretty place raise.",
    "condition": "new",
    "brand": "Thompson, Boone and Nicholson",
    "model": "Model-508",
    "thumbnail": "https://example.com/thumbnail.jpg",
    "tags": [
      "laptop",
      "portable"
    ],
    "complementaryImages": [
      "https://example.com/image0.jpg"
    ],
    "priceNew": 910.13,
    "urlNew": "https://example.com/item-new",
    "category": "books",
    "location": "Kimberlyberg, MI",
    "transactionStatus": []
  },
  {
    "itemId": "item-00003",
    "name": "Maintain",
    "price": 1299.51,
    "quantity": 63,
    "shortdescription": "Perform peace catch tend everybody series wonder.",
    "missingparts": [
      {
        "part": "sure",
        "image": "https://example.com/missing-part.jpg"
      }
    ],
    "defects": [],
    "accessories": [
      {
        "accessory": "age",
        "image": "https://example.com/accessory.jpg"
      }
    ],
    "longdescription": "Generation agency car tell nation event month others. Statement third off employee when. Feeling camera her smile grow shoulder.",
    "condition": "open box",
    "brand": "Meadows Inc",
    "model": "Model-747",
    "thumbnail": "https://example.com/thumbnail.jpg",
    "tags": [
      "wireless",
      "laptop"
    ],
    "complementaryImages": [
      "https://example.com/image0.jpg",
      "https://example.com/image1.jpg"
    ],
    "priceNew": 1171.45,
    "urlNew": "https://example.com/item-new",
    "category": "health",
    "location": "South Stephanieside, OR",
    "transactionStatus": []
  },
  {
    "itemId": "item-00004",
    "name": "Serious",
    "price": 619.65,
    "quantity": 51,
    "shortdescription": "Particular his too best six few human.",
    "missingparts": [],
    "defects": [
      {
        "defect": "here issue",
        "image": "https://example.com/defect.jpg"
      },
      {
        "defect": "defense issue",
        "image": "https://example.com/defect.jpg"
      }
    ],
    "accessories": [
      {
        "accessory": "behavior",
        "image": "https://example.com/accessory.jpg"
      },
      {
        "accessory": "degree",
        "image": "https://example.com/accessory.jpg"
      }
    ],
    "longdescription": "College such compare too.",
    "condition": "used",
    "brand": "Green PLC",
    "model": "Model-423",
    "thumbnail": "https://example.com/thumbnail.jpg",
    "tags": [
      "portable"
    ],
    "complementaryImages": [
      "https://example.com/image0.jpg",
      "https://example.com/image1.jpg",
      "https://example.com/image2.jpg"
    ],
    "priceNew": 1735.99,
    "urlNew": "https://example.com/item-new",
    "category": "clothing",
    "location": "New Jessicachester, WI",
    "transactionStatus": []
  },
  {
    "itemId": "item-00005",
    "name": "Choice",
    "price": 580.33,
    "quantity": 99,
    "shortdescription": "North outside her challenge kitchen.",
    "missingparts": [],
    "defects": [
      {
        "defect": "affect issue",
        "image": "https://example.com/defect.jpg"
      },
      {
        "defect": "time issue",
        "image": "https://example.com/defect.jpg"
      }
    ],
    "accessories": [
      {
        "accessory": "meet",
        "image": "https://example.com/accessory.jpg"
      }
    ],
    "longdescription": "Expect international night it coach between rule. System player lawyer civil form. Herself reflect camera drop young.",
    "condition": "refurbished",
    "brand": "Montgomery Ltd",
    "model": "Model-439",
    "thumbnail": "https://example.com/thumbnail.jpg",
    "tags": [
      "laptop",
      "electronics",
      "wireless"
    ],
    "complementaryImages": [
      "https://example.com/image0.jpg",
      "https://example.com/image1.jpg"
    ],
    "priceNew": 1894.49,
    "urlNew": "https://example.com/item-new",
    "category": "sports",
    "location": "West Aprilmouth, MD",
    "transactionStatus": [
      "transaction13642",
      "transaction37450"
    ]
  },
  {
    "itemId": "item-00006",
    "name": "Central",
    "price": 1220.99,
    "quantity": 35,
    "shortdescription": "Wall reason serve ask public all.",
    "missingparts": [
      {
        "part": "we",
        "image": "https://example.com/missing-part.jpg"
      }
    ],
    "defects": [],
    "accessories": [
      {
        "accessory": "write",
        "image": "https://example.com/accessory.jpg"
      },
      {
        "accessory": "six",
        "image": "https://example.com/accessory.jpg"
      }
    ],
    "longdescription": "Including start join especially from time. Democrat civil bar list pull hair the. Practice despite model compare where follow.",
    "condition": "refurbished",
    "brand": "Rivera LLC",
    "model": "Model-320",
    "thumbnail": "https://example.com/thumbnail.jpg",
    "tags": [
      "wireless"
    ],
    "complementaryImages": [
      "https://example.com/image0.jpg",
      "https://example.com/image1.jpg",
      "https://example.com/image2.jpg"
    ],
    "priceNew": 380.4,
    "urlNew": "https://example.com/item-new",
    "category": "health",
    "location": "Lake William, AL",
    "transactionStatus": []
  },
  {
    "itemId": "item-00007",
    "name": "They",
    "price": 694.55,
    "quantity": 36,
    "shortdescription": "Line who anyone establish actually very door.",
    "missingparts": [],
    "defects": [
      {
        "defect": "character issue",
        "image": "https://example.com/defect.jpg"
      },
      {
        "defect": "cut issue",
        "image": "https://example.com/defect.jpg"
      }
    ],
    "accessories": [],
    "longdescription": "Close matter that evening during. Might meet idea dream through bring. Customer whose collection read stage couple.",
    "condition": "new",
    "brand": "Booth LLC",
    "model": "Model-807",
    "thumbnail": "https://example.com/thumbnail.jpg",
    "tags": [
      "computer",
      "accessory"
    ],
    "complementaryImages": [
      "https://example.com/image0.jpg"
    ],
    "priceNew": 2336.04,
    "urlNew": "https://example.com/item-new",
    "category": "jewelry",
    "location": "Wendyburgh, VT",
    "transactionStatus": []
  },
  {
    "itemId": "item-00008",
    "name": "Deal",
    "price": 1828.6,
    "quantity": 18,
    "shortdescription": "Prove recognize wife stop career cup lot.",
    "missingparts": [],
    "defects": [
      {
        "defect": "concern issue",
        "image": "https://example.com/defect.jpg"
      }
    ],
    "accessories": [
      {
        "accessory": "shake",
        "image": "https://example.com/accessory.jpg"
      }
    ],
    "longdescription": "Key television consumer power.",
    "condition": "used",
    "brand": "Wyatt and Sons",
    "model": "Model-980",
    "thumbnail": "https://example.com/thumbnail.jpg",
    "tags": [
      "portable",
      "laptop",
      "accessory"
    ],
    "complementaryImages": [
      "https://example.com/image0.jpg",
      "https://example.com/image1.jpg"
    ],
    "priceNew": 2330.89,
    "urlNew": "https://example.com/item-new",
    "category": "clothing",
    "location": "Kleinton, WV",
    "transactionStatus": []
  },
  {
    "itemId": "item-00009",
    "name": "Road",
    "price": 1009.04,
    "quantity": 78,
    "shortdescription": "Where commercial crime difficult.",
    "missingparts": [
      {
        "part": "across",
        "image": "https://example.com/missing-part.jpg"
      }
    ],
    "defects": [
      {
        "defect": "yet issue",
        "image": "https://example.com/defect.jpg"
      }
    ],
    "accessories": [],
    "longdescription": "Level north stand might. None second year well because.",
    "condition": "refurbished",
    "brand": "Turner-Cole",
    "model": "Model-339",
    "thumbnail": "https://example.com/thumbnail.jpg",
    "tags": [
      "accessory",
      "wireless",
      "computer"
    ],
    "complementaryImages": [
      "https://example.com/image0.jpg"
    ],
    "priceNew": 1909.77,
    "urlNew": "https://example.com/item-new",
    "category": "health",
    "location": "South Sarah, RI",
    "transactionStatus": [
      "transaction15127",
      "transaction27377"
    ]
  },
  {
    "itemId": "item-00010",
    "name": "Staff",
    "price": 804.37,
    "quantity": 56,
    "shortdescription": "Record everybody hospital well type free cell.",
    "missingparts": [
      {
        "part": "believe",
        "image": "https://example.com/missing-part.jpg"
      },
      {
        "part": "Republican",
        "image": "https://example.com/missing-part.jpg"
      }
    ],